{
  "$schema": "https://json-schema.org/draft/2020-12/schema",
  "title": "Fincent transactions.json",
  "description": "Array of portfolio transactions in chronological order.",
  "type": "array",
  "minItems": 1,
  "items": {
    "type": "object",
    "required": ["transaction_id", "account_id", "date", "type", "amount", "currency"],
    "additionalProperties": true,
    "properties": {
      "transaction_id": {
        "type": "string",
        "minLength": 1,
        "description": "Unique transaction identifier (e.g. 'TXN-0001')."
      },
      "account_id": {
        "type": "string",
        "minLength": 1,
        "description": "Reference to the account this transaction belongs to."
      },
      "date": {
        "type": "string",
        "pattern": "^\\d{4}-\\d{2}-\\d{2}$",
        "description": "Transaction settlement date in YYYY-MM-DD format."
      },
      "type": {
        "type": "string",
        "enum": ["buy", "sell", "deposit", "withdrawal", "dividend", "interest", "fee"],
        "description": "Transaction type."
      },
      "ticker": {
        "type": ["string", "null"],
        "description": "Ticker symbol involved (null for account-level transactions such as fees)."
      },
      "quantity": {
        "type": ["number", "null"],
        "description": "Number of shares bought/sold (null for non-trade transactions)."
      },
      "price": {
        "type": ["number", "null"],
        "description": "Price per share at execution (null for non-trade transactions)."
      },
      "amount": {
        "type": "number",
        "description": "Net cash amount: positive = cash in, negative = cash out."
      },
      "currency": {
        "type": "string",
        "minLength": 3,
        "maxLength": 3,
        "description": "ISO 4217 currency code (e.g. 'USD')."
      },
      "note": {
        "type": "string",
        "description": "Optional free-text annotation."
      }
    }
  }
}
