[
  {
    "transaction_id": "TXN-OPEN-SPAXX",
    "account_id": "ACC-004",
    "date": "2022-01-10",
    "type": "deposit",
    "ticker": "SPAXX",
    "quantity": null,
    "price": null,
    "amount": 160000.0,
    "currency": "USD",
    "note": "Opening cash balance"
  },
  {
    "transaction_id": "TXN-OPEN-AAPL",
    "account_id": "ACC-001",
    "date": "2022-01-12",
    "type": "buy",
    "ticker": "AAPL",
    "quantity": 500,
    "price": 148.5,
    "amount": 74250.0,
    "currency": "USD",
    "note": "Opening position"
  },
  {
    "transaction_id": "TXN-OPEN-MSFT",
    "account_id": "ACC-001",
    "date": "2022-01-12",
    "type": "buy",
    "ticker": "MSFT",
    "quantity": 350,
    "price": 270.0,
    "amount": 94500.0,
    "currency": "USD",
    "note": "Opening position"
  },
  {
    "transaction_id": "TXN-OPEN-NVDA",
    "account_id": "ACC-001",
    "date": "2022-01-12",
    "type": "buy",
    "ticker": "NVDA",
    "quantity": 100,
    "price": 220.0,
    "amount": 22000.0,
    "currency": "USD",
    "note": "Opening position"
  },
  {
    "transaction_id": "TXN-OPEN-BND",
    "account_id": "ACC-003",
    "date": "2022-02-02",
    "type": "buy",
    "ticker": "BND",
    "quantity": 800,
    "price": 76.5,
    "amount": 61200.0,
    "currency": "USD",
    "note": "Opening position"
  },
  {
    "transaction_id": "TXN-OPEN-TLT",
    "account_id": "ACC-003",
    "date": "2022-02-02",
    "type": "buy",
    "ticker": "TLT",
    "quantity": 300,
    "price": 118.0,
    "amount": 35400.0,
    "currency": "USD",
    "note": "Opening position"
  },
  {
    "transaction_id": "TXN-OPEN-JNJ",
    "account_id": "ACC-002",
    "date": "2022-03-17",
    "type": "buy",
    "ticker": "JNJ",
    "quantity": 180,
    "price": 162.0,
    "amount": 29160.0,
    "currency": "USD",
    "note": "Opening position"
  },
  {
    "transaction_id": "TXN-OPEN-KO",
    "account_id": "ACC-002",
    "date": "2022-03-17",
    "type": "buy",
    "ticker": "KO",
    "quantity": 800,
    "price": 58.5,
    "amount": 46800.0,
    "currency": "USD",
    "note": "Opening position"
  },
  {
    "transaction_id": "TXN-OPEN-PG",
    "account_id": "ACC-002",
    "date": "2022-03-17",
    "type": "buy",
    "ticker": "PG",
    "quantity": 300,
    "price": 138.0,
    "amount": 41400.0,
    "currency": "USD",
    "note": "Opening position"
  },
  {
    "transaction_id": "TXN-OPEN-VZ",
    "account_id": "ACC-002",
    "date": "2022-03-17",
    "type": "buy",
    "ticker": "VZ",
    "quantity": 800,
    "price": 45.0,
    "amount": 36000.0,
    "currency": "USD",
    "note": "Opening position"
  },
  {
    "transaction_id": "TXN-0111",
    "account_id": "ACC-004",
    "date": "2023-01-05",
    "type": "deposit",
    "ticker": "SPAXX",
    "quantity": null,
    "price": null,
    "amount": 25000.0,
    "currency": "USD"
  },
  {
    "transaction_id": "TXN-B0301",
    "account_id": "ACC-003",
    "date": "2023-01-07",
    "type": "interest",
    "ticker": "BND",
    "quantity": null,
    "price": null,
    "amount": 268.6,
    "currency": "USD"
  },
  {
    "transaction_id": "TXN-S0501",
    "account_id": "ACC-004",
    "date": "2023-01-28",
    "type": "interest",
    "ticker": "SPAXX",
    "quantity": null,
    "price": null,
    "amount": 666.67,
    "currency": "USD"
  },
  {
    "transaction_id": "TXN-0005",
    "account_id": "ACC-001",
    "date": "2023-02-02",
    "type": "buy",
    "ticker": "AAPL",
    "quantity": 35,
    "price": 158.75,
    "amount": 5556.25,
    "currency": "USD"
  },
  {
    "transaction_id": "TXN-B0302",
    "account_id": "ACC-003",
    "date": "2023-02-07",
    "type": "interest",
    "ticker": "BND",
    "quantity": null,
    "price": null,
    "amount": 268.6,
    "currency": "USD"
  },
  {
    "transaction_id": "TXN-S0502",
    "account_id": "ACC-004",
    "date": "2023-02-28",
    "type": "interest",
    "ticker": "SPAXX",
    "quantity": null,
    "price": null,
    "amount": 666.67,
    "currency": "USD"
  },
  {
    "transaction_id": "TXN-T0401",
    "account_id": "ACC-003",
    "date": "2023-03-01",
    "type": "interest",
    "ticker": "TLT",
    "quantity": null,
    "price": null,
    "amount": 490.19,
    "currency": "USD"
  },
  {
    "transaction_id": "TXN-B0303",
    "account_id": "ACC-003",
    "date": "2023-03-07",
    "type": "interest",
    "ticker": "BND",
    "quantity": null,
    "price": null,
    "amount": 268.6,
    "currency": "USD"
  },
  {
    "transaction_id": "TXN-0075",
    "account_id": "ACC-003",
    "date": "2023-03-10",
    "type": "buy",
    "ticker": "BND",
    "quantity": 150,
    "price": 74.2,
    "amount": 11130.0,
    "currency": "USD"
  },
  {
    "transaction_id": "TXN-D0201",
    "account_id": "ACC-001",
    "date": "2023-03-15",
    "type": "dividend",
    "ticker": "AAPL",
    "quantity": null,
    "price": null,
    "amount": 144.0,
    "currency": "USD"
  },
  {
    "transaction_id": "TXN-D0202",
    "account_id": "ACC-001",
    "date": "2023-03-15",
    "type": "dividend",
    "ticker": "MSFT",
    "quantity": null,
    "price": null,
    "amount": 255.0,
    "currency": "USD"
  },
  {
    "transaction_id": "TXN-D0203",
    "account_id": "ACC-002",
    "date": "2023-03-20",
    "type": "dividend",
    "ticker": "JNJ",
    "quantity": null,
    "price": null,
    "amount": 258.0,
    "currency": "USD"
  },
  {
    "transaction_id": "TXN-D0204",
    "account_id": "ACC-002",
    "date": "2023-03-20",
    "type": "dividend",
    "ticker": "PG",
    "quantity": null,
    "price": null,
    "amount": 329.0,
    "currency": "USD"
  },
  {
    "transaction_id": "TXN-D0205",
    "account_id": "ACC-002",
    "date": "2023-03-20",
    "type": "dividend",
    "ticker": "KO",
    "quantity": null,
    "price": null,
    "amount": 391.0,
    "currency": "USD"
  },
  {
    "transaction_id": "TXN-D0206",
    "account_id": "ACC-002",
    "date": "2023-03-20",
    "type": "dividend",
    "ticker": "VZ",
    "quantity": null,
    "price": null,
    "amount": 528.0,
    "currency": "USD"
  },
  {
    "transaction_id": "TXN-0033",
    "account_id": "ACC-002",
    "date": "2023-03-24",
    "type": "buy",
    "ticker": "JNJ",
    "quantity": 30,
    "price": 109.53,
    "amount": 3285.9,
    "currency": "USD"
  },
  {
    "transaction_id": "TXN-S0503",
    "account_id": "ACC-004",
    "date": "2023-03-28",
    "type": "interest",
    "ticker": "SPAXX",
    "quantity": null,
    "price": null,
    "amount": 666.67,
    "currency": "USD"
  },
  {
    "transaction_id": "TXN-0004",
    "account_id": "ACC-001",
    "date": "2023-04-02",
    "type": "buy",
    "ticker": "AAPL",
    "quantity": 35,
    "price": 178.62,
    "amount": 6251.7,
    "currency": "USD"
  },
  {
    "transaction_id": "TXN-B0304",
    "account_id": "ACC-003",
    "date": "2023-04-07",
    "type": "interest",
    "ticker": "BND",
    "quantity": null,
    "price": null,
    "amount": 268.6,
    "currency": "USD"
  },
  {
    "transaction_id": "TXN-0115",
    "account_id": "ACC-004",
    "date": "2023-04-10",
    "type": "withdrawal",
    "ticker": "SPAXX",
    "quantity": null,
    "price": null,
    "amount": -12000.0,
    "currency": "USD",
    "note": "Transferred to brokerage"
  },
  {
    "transaction_id": "TXN-0003",
    "account_id": "ACC-001",
    "date": "2023-04-17",
    "type": "buy",
    "ticker": "AAPL",
    "quantity": 70,
    "price": 182.07,
    "amount": 12744.9,
    "currency": "USD"
  },
  {
    "transaction_id": "TXN-0013",
    "account_id": "ACC-001",
    "date": "2023-04-17",
    "type": "buy",
    "ticker": "NVDA",
    "quantity": 15,
    "price": 263.07,
    "amount": 3946.05,
    "currency": "USD"
  },
  {
    "transaction_id": "TXN-0001",
    "account_id": "ACC-001",
    "date": "2023-04-27",
    "type": "buy",
    "ticker": "AAPL",
    "quantity": 55,
    "price": 156.0,
    "amount": 8580.0,
    "currency": "USD"
  },
  {
    "transaction_id": "TXN-S0504",
    "account_id": "ACC-004",
    "date": "2023-04-28",
    "type": "interest",
    "ticker": "SPAXX",
    "quantity": null,
    "price": null,
    "amount": 666.67,
    "currency": "USD"
  },
  {
    "transaction_id": "TXN-B0305",
    "account_id": "ACC-003",
    "date": "2023-05-07",
    "type": "interest",
    "ticker": "BND",
    "quantity": null,
    "price": null,
    "amount": 268.6,
    "currency": "USD"
  },
  {
    "transaction_id": "TXN-S0505",
    "account_id": "ACC-004",
    "date": "2023-05-28",
    "type": "interest",
    "ticker": "SPAXX",
    "quantity": null,
    "price": null,
    "amount": 666.67,
    "currency": "USD"
  },
  {
    "transaction_id": "TXN-0112",
    "account_id": "ACC-004",
    "date": "2023-06-01",
    "type": "deposit",
    "ticker": "SPAXX",
    "quantity": null,
    "price": null,
    "amount": 15000.0,
    "currency": "USD"
  },
  {
    "transaction_id": "TXN-T0402",
    "account_id": "ACC-003",
    "date": "2023-06-01",
    "type": "interest",
    "ticker": "TLT",
    "quantity": null,
    "price": null,
    "amount": 490.19,
    "currency": "USD"
  },
  {
    "transaction_id": "TXN-B0306",
    "account_id": "ACC-003",
    "date": "2023-06-07",
    "type": "interest",
    "ticker": "BND",
    "quantity": null,
    "price": null,
    "amount": 268.6,
    "currency": "USD"
  },
  {
    "transaction_id": "TXN-0010",
    "account_id": "ACC-001",
    "date": "2023-06-15",
    "type": "buy",
    "ticker": "MSFT",
    "quantity": 15,
    "price": 384.72,
    "amount": 5770.8,
    "currency": "USD"
  },
  {
    "transaction_id": "TXN-D0207",
    "account_id": "ACC-001",
    "date": "2023-06-15",
    "type": "dividend",
    "ticker": "AAPL",
    "quantity": null,
    "price": null,
    "amount": 144.0,
    "currency": "USD"
  },
  {
    "transaction_id": "TXN-D0208",
    "account_id": "ACC-001",
    "date": "2023-06-15",
    "type": "dividend",
    "ticker": "MSFT",
    "quantity": null,
    "price": null,
    "amount": 255.0,
    "currency": "USD"
  },
  {
    "transaction_id": "TXN-0038",